{
  "aggregate_per_mic_rms": {
    "front": 0.0,
    "left": 0.0,
    "rear": 0.0,
    "right": 0.0
  },
  "array_id": "rig_front",
  "array_pose": {
    "coordinate_convention": "x_forward_y_right_z_up_clockwise_bearing",
    "frame": "world",
    "orientation_xyzw": [
      0.0,
      0.0,
      0.0,
      1.0
    ],
    "position_m": [
      0.0,
      0.0,
      0.0
    ]
  },
  "backend_id": "analytic_acoustics",
  "coordinate_convention": "x_forward_y_right_z_up_clockwise_bearing",
  "detections": [],
  "diagnostics": {
    "active_source_count": 0,
    "ambiguity_policy": "none",
    "analytic_acoustics_options": {
      "air_absorption": false,
      "max_order": 2,
      "ray_tracing": false
    },
    "analytic_solver": {
      "environment_kind": "shoebox",
      "provider": "pyroomacoustics",
      "solver_id": "pyroom_shoebox"
    },
    "backend": "analytic_acoustics",
    "doa_estimator": "tdoa_least_squares",
    "environment_config": {
      "absorption": {
        "ceiling": 0.35,
        "floor": 0.35,
        "wall_x_max": 0.35,
        "wall_x_min": 0.35,
        "wall_y_max": 0.35,
        "wall_y_min": 0.35
      },
      "dimensions_m": [
        5.0,
        6.0,
        2.7
      ],
      "environment_id": "lab_room_a",
      "kind": "shoebox",
      "orientation_world_quat": [
        0.0,
        0.0,
        0.0,
        1.0
      ],
      "position_world": [
        -0.5,
        -3.5,
        -0.5
      ],
      "surface_count": 6
    },
    "environment_id": "lab_room_a",
    "max_detections": 0,
    "per_source_rir_length_samples": {},
    "per_source_rir_summary": {},
    "physical_waveform": true,
    "pyroomacoustics_version": "0.10.1",
    "sample_rate_hz": 48000,
    "scheduled_source_ids": [],
    "speed_of_sound_mps": 343.0,
    "time_window_s": [
      0.0,
      0.1
    ],
    "window_sample_count": 4800
  },
  "end_time_s": 0.1,
  "frame_id": "analytic_acoustics_demo_audio_lab_single_source_rig_front_0_0",
  "frame_index": 0,
  "frame_name": "demo_audio_lab_single_source/rig_front/analytic_acoustics/frame0_t0ms",
  "max_detections": 0,
  "provenance": "room_acoustics",
  "sample_rate_hz": 48000,
  "schema_version": "ias.audio_sensor_frame.v2",
  "start_time_s": 0.0,
  "timestamp_ms": 0,
  "units": {
    "bearing": "deg_clockwise_from_array_forward",
    "distance": "m",
    "elevation": "deg_up_from_array_horizontal",
    "gain": "dB",
    "orientation": "quaternion_xyzw",
    "position": "m",
    "rms": "linear",
    "sample_rate": "Hz",
    "time": "s",
    "timestamp": "ms"
  },
  "waveform_paths": []
}
